{"schema_version":"1.0.0","profile_id":"foio-au-wa","profile_version":"0.1.0","profile_sha256":"ff74eb3504f02c45291bd5862ed344ef7117698be44a9d2169e78f60df7183d9","status":"disabled","country":"AU","jurisdiction_id":"AU-WA","jurisdiction_name":"Western Australia","corpus":{"default_id":"corpus-au-wa-foi","id_pattern":"^corpus-au-wa-[a-z0-9-]+$"},"capabilities":{"route_records":"disabled","extract_assertions":"disabled","export_ontology":"disabled"},"ontology_pin":null,"blockers":["Authentic source, authority, effective-date, and ontology pins are not registered."]}
