{"schema_version":"1.0.0","profile_id":"foio-au-vic","profile_version":"0.1.0","profile_sha256":"9989bcb721001e0a3adcd9fd66e24addd97c80f7653850ddf76b76f63c5da52f","status":"disabled","country":"AU","jurisdiction_id":"AU-VIC","jurisdiction_name":"Victoria","corpus":{"default_id":"corpus-au-vic-foi","id_pattern":"^corpus-au-vic-[a-z0-9-]+$"},"capabilities":{"route_records":"disabled","extract_assertions":"disabled","export_ontology":"disabled"},"ontology_pin":null,"blockers":["Authentic source, authority, effective-date, and ontology pins are not registered."]}
