{"schema_version":"1.0.0","profile_id":"foio-au-nt","profile_version":"0.1.0","profile_sha256":"f53a6a3028277787c62a47ba126f746b6fcc3e38e5d7a06f982ba090089972e4","status":"disabled","country":"AU","jurisdiction_id":"AU-NT","jurisdiction_name":"Northern Territory","corpus":{"default_id":"corpus-au-nt-foi","id_pattern":"^corpus-au-nt-[a-z0-9-]+$"},"capabilities":{"route_records":"disabled","extract_assertions":"disabled","export_ontology":"disabled"},"ontology_pin":null,"blockers":["Authentic source, authority, effective-date, and ontology pins are not registered."]}
