{"schema_version":"1.0.0","profile_id":"foio-au-qld","profile_version":"0.1.0","profile_sha256":"cf76dde2fcef6c4dc83ce524140a2cc481e00c53633f897c9a933283445aa033","status":"disabled","country":"AU","jurisdiction_id":"AU-QLD","jurisdiction_name":"Queensland","corpus":{"default_id":"corpus-au-qld-foi","id_pattern":"^corpus-au-qld-[a-z0-9-]+$"},"capabilities":{"route_records":"disabled","extract_assertions":"disabled","export_ontology":"disabled"},"ontology_pin":null,"blockers":["Authentic source, authority, effective-date, and ontology pins are not registered."]}
